{
  "$schema": "https://json-schema.org/draft/2020-12/schema",
  "$id": "https://kaiak.invalid/protocol/schema/usage-record.schema.json",
  "title": "kaiak usage record",
  "description": "One routed request's settled usage (docs/specs/CONTROL-PROTOCOL.md, Usage records). Never a key, a credential, or request or response content.",
  "type": "object",
  "additionalProperties": false,
  "required": [
    "record_id",
    "request_id",
    "gateway_instance",
    "key_id",
    "groups",
    "model",
    "deployment",
    "units",
    "cost_nano_usd",
    "estimated",
    "partial",
    "gateway_time"
  ],
  "properties": {
    "record_id": {
      "description": "Random, 128 bits, lowercase hex.",
      "type": "string",
      "pattern": "^[0-9a-f]{32}$"
    },
    "request_id": {
      "description": "The request's X-Request-Id: the client's when valid, else generated by the gateway.",
      "type": "string",
      "pattern": "^[A-Za-z0-9._:-]{1,128}$"
    },
    "gateway_instance": {
      "$ref": "common.schema.json#/$defs/instance"
    },
    "key_id": {
      "$ref": "config.schema.json#/$defs/id"
    },
    "groups": {
      "description": "The key's group path in the config the request ran under, top-level group first, the key's own group last. The usage counts toward each listed group the control plane's current config defines, and toward global.",
      "type": "array",
      "minItems": 1,
      "maxItems": 8,
      "uniqueItems": true,
      "items": {
        "$ref": "config.schema.json#/$defs/id"
      }
    },
    "model": {
      "description": "The public model name.",
      "$ref": "config.schema.json#/$defs/public_model_name"
    },
    "deployment": {
      "type": "object",
      "additionalProperties": false,
      "required": [
        "backend",
        "model"
      ],
      "properties": {
        "backend": {
          "$ref": "config.schema.json#/$defs/id"
        },
        "model": {
          "description": "The model name on that backend.",
          "$ref": "config.schema.json#/$defs/backend_model_name"
        }
      }
    },
    "units": {
      "description": "Usage units; every record carries every unit, zeros included. tokens_in, tokens_cached and tokens_cache_write are disjoint and add up to the backend's prompt tokens; tokens_reasoning is the reasoning share of tokens_out. images are images generated; audio_seconds_out seconds of audio generated and audio_seconds_in seconds of audio processed, each measured by the gateway and rounded up to a whole second per record. Media units are disjoint from tokens: a speech record carries both.",
      "type": "object",
      "additionalProperties": false,
      "required": [
        "audio_seconds_in",
        "audio_seconds_out",
        "images",
        "tokens_in",
        "tokens_cached",
        "tokens_cache_write",
        "tokens_out",
        "tokens_reasoning"
      ],
      "properties": {
        "audio_seconds_in": {
          "$ref": "common.schema.json#/$defs/count"
        },
        "audio_seconds_out": {
          "$ref": "common.schema.json#/$defs/count"
        },
        "images": {
          "$ref": "common.schema.json#/$defs/count"
        },
        "tokens_in": {
          "$ref": "common.schema.json#/$defs/count"
        },
        "tokens_cached": {
          "$ref": "common.schema.json#/$defs/count"
        },
        "tokens_cache_write": {
          "$ref": "common.schema.json#/$defs/count"
        },
        "tokens_out": {
          "$ref": "common.schema.json#/$defs/count"
        },
        "tokens_reasoning": {
          "$ref": "common.schema.json#/$defs/count"
        }
      }
    },
    "cost_nano_usd": {
      "description": "Cost in billionths of a US dollar, rounded once per record.",
      "$ref": "common.schema.json#/$defs/count"
    },
    "estimated": {
      "description": "Units estimated: the backend reported no usage.",
      "type": "boolean"
    },
    "partial": {
      "description": "The response stopped early; units count what was relayed.",
      "type": "boolean"
    },
    "gateway_time": {
      "description": "When the gateway settled the record; informational, the control plane aggregates by its own clock.",
      "$ref": "config.schema.json#/$defs/timestamp"
    }
  }
}
