{
  "record_id": "a1b2c3d4e5f60718293a4b5c6d7e8f90",
  "request_id": "9c0d8e7f6a5b4c3d2e1f0a9b8c7d6e5f",
  "gateway_instance": "gw-1",
  "key_id": "k-alice-laptop",
  "groups": [
    "alice"
  ],
  "model": "gpt-4.1-mini",
  "deployment": {
    "backend": "azure-westeurope",
    "model": "gpt-4.1-mini"
  },
  "units": {
    "audio_seconds_in": 0,
    "audio_seconds_out": 0,
    "images": 0,
    "tokens_cache_write": 0,
    "tokens_cached": 1024,
    "tokens_in": 2048,
    "tokens_out": 377,
    "tokens_reasoning": 0
  },
  "cost_nano_usd": 1524000,
  "estimated": true,
  "partial": true,
  "gateway_time": "2026-09-24T10:00:01Z"
}
