{
  "record_id": "3f2a9c1e5b7d4f608192a3b4c5d6e7f8",
  "request_id": "req-01J8ZK3M4N5P6Q",
  "gateway_instance": "gw-1",
  "key_id": "k-eval-ci",
  "groups": [
    "research",
    "rag",
    "prod",
    "eval-pipeline"
  ],
  "model": "qwen3-32b",
  "deployment": {
    "backend": "vllm-a",
    "model": "Qwen/Qwen3-32B"
  },
  "units": {
    "audio_seconds_in": 0,
    "audio_seconds_out": 0,
    "images": 0,
    "tokens_cache_write": 0,
    "tokens_cached": 0,
    "tokens_in": 812,
    "tokens_out": 240,
    "tokens_reasoning": 96
  },
  "cost_nano_usd": 0,
  "estimated": false,
  "partial": false,
  "gateway_time": "2026-09-24T10:00:00.123456789Z"
}
