{
  "record_id": "3f6a9c2e5b8d41f7a0c3e6b9d2f5a8c1",
  "request_id": "req-01K72SPEECH0001",
  "gateway_instance": "gw-1",
  "key_id": "k-alice-laptop",
  "groups": [
    "users",
    "alice"
  ],
  "model": "qwen3-tts",
  "deployment": {
    "backend": "omni-tts",
    "model": "Qwen/Qwen3-TTS-12Hz-1.7B-CustomVoice"
  },
  "units": {
    "audio_seconds_in": 0,
    "audio_seconds_out": 7,
    "images": 0,
    "tokens_cache_write": 0,
    "tokens_cached": 0,
    "tokens_in": 21,
    "tokens_out": 83,
    "tokens_reasoning": 0
  },
  "cost_nano_usd": 0,
  "estimated": false,
  "partial": false,
  "gateway_time": "2026-10-09T12:00:00.5Z"
}
