{
  "record_id": "3f6a9c2e5b8d41f7a0c3e6b9d2f5a8c2",
  "request_id": "req-01K72IMAGES0001",
  "gateway_instance": "gw-1",
  "key_id": "k-alice-laptop",
  "groups": [
    "users",
    "alice"
  ],
  "model": "qwen-image",
  "deployment": {
    "backend": "omni-image",
    "model": "Qwen/Qwen-Image"
  },
  "units": {
    "audio_seconds_in": 0,
    "audio_seconds_out": 0,
    "images": 4,
    "tokens_cache_write": 0,
    "tokens_cached": 0,
    "tokens_in": 30,
    "tokens_out": 0,
    "tokens_reasoning": 0
  },
  "cost_nano_usd": 0,
  "estimated": true,
  "partial": false,
  "gateway_time": "2026-10-09T12:00:01Z"
}
